{
  "required" : true ,
  "$schema" : "http://json-schema.org/draft-03/schema" ,
  "type" : "object" ,
  "properties" : {
    "categories" : {
      "type" : "array" ,
      "required" : false ,
      "items" : 
        {
          "type" : "string"
        }
      
    } ,
    "layout" : {
      "type" : "string" ,
      "required" : false
    } ,
    "published" : {
      "type" : "boolean" ,
      "required" : false
    } ,
    "title" : {
      "type" : "string" ,
      "required" : false
    } ,
    "lang" : {
      "type" : "string" ,
      "required" : false
    } ,
    "tags" : {
      "type" : "array" ,
      "required" : false ,
      "items" : 
        {
          "type" : "string"
        }
      
    } ,
    "url" : {
      "type" : "string" ,
      "required" : false
    } ,
    "content" : {
      "type" : "string" ,
      "required" : false
    } ,
    "date" : {
      "type" : "string" ,
      "required" : false
    } ,
    "sort" : {
      "type" : "number" ,
      "required" : false
    } ,
    "id" : {
      "type" : "string" ,
      "required" : false
    } ,
    "excerpt" : {
      "type" : "string" ,
      "required" : false
    } ,
    "path" : {
      "type" : "string" ,
      "required" : false
    }
  }
}